{
  "name": "full-snapshot-mask-asterisk-worldcities",
  "description": "Dataset Full Snapshot World Cities",
  "sourceName": "source1",
  "typ": { "value": "file" },
  "version": 1,
  "enabled": true,
  "classification": { "value": "public" },
  "effectiveDate": "2020-07-03 10:10:00",
  "ingestionMode": { "value": "full_snapshot" },
  "validationMode": { "value": "fail_fast" },
  "createDatabase": true,
  "database": "database6",
  "table": "full_snapshot_mask_asterisk_worldcities",
  "partitionBy": "yyyy/mm/dd",
  "permissiveThresholdType": {"value" :"absolute"},
  "permissiveThreshold": 10,
  "fileInput":{
    "format": { "value": "csv" },
    "filePattern": "<yyyy><mm><dd>_mask_asterisk_worldCities.csv",
    "csv": {
      "charset": "UTF-8",
      "header": { "value": "first_line"},
      "delimiter":  ","
    }
  },
  "schemaDefinition": {"value": "json-columns"},
  "schemaFile": "",
  "schemaColumns": {
    "columns": [
      {
        "name": "name",
        "typ": {"value":  "string"},
        "isPrimaryKey": false,
        "isTimestamp": false,
        "position": 1,
        "sensitive": false
      },
      {
        "name": "country",
        "typ": {"value":  "string"},
        "isPrimaryKey": false,
        "isTimestamp": false,
        "position": 2,
        "sensitive": false
      },
      {
        "name": "subcountry",
        "typ": {"value":  "string"},
        "isPrimaryKey": false,
        "isTimestamp": false,
        "position": 3,
        "sensitive": false,
        "transformation" : {
          "typ": {"value": "udf"},
          "udf": "mask-asterisk"
        }
      },
      {
        "name": "geonameid",
        "typ": {"value":  "long"},
        "isPrimaryKey": true,
        "isTimestamp": false,
        "position": 4,
        "sensitive": false
      },
      {
        "name": "timeStamp",
        "typ": {"value":  "datetime"},
        "isPrimaryKey": false,
        "isTimestamp": true,
        "position": 5,
        "sensitive": false,
        "transformation" : {
          "typ": {"value": "date"},
          "pattern": "yyyy-MM-dd HH:mm:ss"
        }
      }
    ]
  }
}