{
  "name": "dataset-sqlserver-fullsnapshot-extra-columns-ok",
  "description": "dataset sqlserver full snapshot with more columns in table than json",
  "sourceName": "source-sqlserver",
  "typ": { "value": "table" },
  "version": 1,
  "enabled": true,
  "classification": { "value": "public" },
  "effectiveDate": "2020-07-03 10:10:00",
  "ingestionMode": { "value": "full_snapshot" },
  "validationMode": { "value": "fail_fast" },
  "createDatabase": true,
  "database": "Production",
  "table": "ProductCategoryFSEC",
  "partitionBy": "",
  "permissiveThresholdType": {"value" :"absolute"},
  "permissiveThreshold": 10,
  "tableInput":{
    "table": "ProductCategory",
    "schema": "Production"
  },
  "schemaDefinition": {"value": "json-columns"},
  "schemaFile": "",
  "schemaColumns": {
    "columns": [
      {
        "name": "ProductCategoryID",
        "typ": {"value":  "integer"},
        "isPrimaryKey": true,
        "isTimestamp": false,
        "position": 1,
        "sensitive": false
      },
      {
        "name": "Name",
        "typ": {"value":  "string"},
        "isPrimaryKey": false,
        "isTimestamp": false,
        "position": 2,
        "sensitive": false
      }
    ]
  }
}