{
  "name": "full-snapshot-worldcities-sensitive-validator-3",
  "description": "Dataset Full Snapshot World Cities Sensitive Validator",
  "sourceName": "source1",
  "typ": { "value": "table" },
  "version": 1,
  "enabled": true,
  "classification": { "value": "public" },
  "effectiveDate": "2020-07-03 10:10:00",
  "ingestionMode": { "value": "incremental" },
  "validationMode": { "value": "fail_fast" },
  "createDatabase": true,
  "database": "database1",
  "table": "full_snapshot_worldcities_sensitive_validator_3",
  "partitionBy": "",
  "permissiveThresholdType": {"value" :"absolute"},
  "permissiveThreshold": 10,
  "tableInput":{
    "table": "full_snapshot_worldcities_sensitive_validator_3",
    "schema": "database1",
    "query": "select * from database1.full_snapshot_worldcities_sensitive_validator_3 where ModifiedDate > to_timestamp('asdf', 'yyyy-MM-dd HH:mm:ss.SSS')",
    "onlyNewData": true
  },
  "schemaDefinition": {"value": "json-columns"},
  "schemaFile": "",
  "schemaColumns": {
    "columns": [
      {
        "name": "name",
        "typ": {"value":  "string"},
        "isPrimaryKey": false,
        "isTimestamp": false,
        "position": 1,
        "sensitive": true
      },
      {
        "name": "country",
        "alias": "country_alias",
        "typ": {"value":  "string"},
        "isPrimaryKey": false,
        "isTimestamp": false,
        "position": 2,
        "sensitive": true
      },
      {
        "name": "subcountry",
        "typ": {"value":  "string"},
        "isPrimaryKey": false,
        "isTimestamp": false,
        "position": 3,
        "sensitive": false
      },
      {
        "name": "geonameid",
        "alias": "geonameid_alias",
        "typ": {"value":  "long"},
        "isPrimaryKey": false,
        "isTimestamp": false,
        "position": 4,
        "sensitive": true
      },
      {
        "name": "timeStamp",
        "alias": "timeStamp_alias",
        "typ": {"value":  "integer"},
        "isPrimaryKey": false,
        "isTimestamp": true,
        "isPartitionable": true,
        "position": 5,
        "sensitive": true,
        "transformation" : {
          "typ": {"value": "date"},
          "pattern": "yyyy-MM-dd HH:mm:ss"
        }
      },
      {
        "name": "city",
        "typ": {"value":  "struct"},
        "position": 6,
        "sensitive": false
      },
      {
        "name": "address",
        "typ": {"value":  "string"},
        "position": 7,
        "sensitive": true,
        "parentName": "city"
      }
    ]
  },
  "qualityRules": {
    "mode": { "value": "reject" },
    "uniquenessRule": {
      "rules": [
        {
          "name": "uniqueRule1",
          "columns": ["name","country"]
        }
      ]
    },
    "notNullRule": ["country"],
    "integrityRule": {
      "rules": [
        {
          "name": "Integrity1",
          "localColumns": ["country"],
          "referencedTable": "database1.last_changes_worldcities",
          "referencedColumns": ["country"]
        }
      ]},
    "expressionRule": {
      "rules": [
        {
          "name": "expr1",
          "expr": "geonameid >= 1"
        }
      ]
    }
  }
}