{
  "name": "full-snapshot-worldcities-subset-orc",
  "description": "Dataset Full Snapshot World Cities",
  "sourceName": "source4",
  "typ": { "value": "file" },
  "version": 1,
  "enabled": true,
  "classification": { "value": "public" },
  "effectiveDate": "2020-07-03 10:10:00",
  "ingestionMode": { "value": "full_snapshot" },
  "validationMode": { "value": "fail_fast" },
  "createDatabase": true,
  "database": "database4",
  "table": "full_snapshot_worldcities_subset_orc",
  "partitionBy": "yyyy/mm/dd",
  "permissiveThresholdType": {"value" :"absolute"},
  "permissiveThreshold": 10,
  "fileInput":{
    "format": { "value": "orc" },
    "filePattern": "<yyyy><mm><dd>_worldCities.zlib.orc"
  },
  "schemaDefinition": {"value": "json-columns"},
  "schemaFile": "",
  "schemaColumns": {
    "columns": [
      {
        "name": "name",
        "typ": {"value":  "string"},
        "isPrimaryKey": false,
        "isTimestamp": false,
        "position": 1,
        "sensitive": false
      },
      {
        "name": "country",
        "typ": {"value":  "string"},
        "isPrimaryKey": false,
        "isTimestamp": false,
        "position": 2,
        "sensitive": false
      },
      {
        "name": "subcountry",
        "typ": {"value":  "string"},
        "isPrimaryKey": false,
        "isTimestamp": false,
        "position": 3,
        "sensitive": false
      },
      {
        "name": "geonameid",
        "typ": {"value":  "long"},
        "isPrimaryKey": true,
        "isTimestamp": false,
        "position": 4,
        "sensitive": false
      }
    ]
  }
}